{
  "$schema": "./donors.schema.json",
  "version": "1.0.0",
  "lastUpdatedAt": "2026-09-19",
  "sourceCampaign": "https://whydonate.com/nl/fundraising/houd-parknest-open-in-de-winter",
  "notes": {
    "nl": "Alleen namen opnemen die bewust als openbare dankvermelding gebruikt mogen worden. Geen bedragen, e-mailadressen of andere donateurgegevens opslaan.",
    "en": "Only include names that are intentionally approved for public acknowledgement. Do not store donation amounts, email addresses, or other donor data."
  },
  "donors": [
    {
      "name": "Katinka"
    },
    {
      "name": "Dirk"
    },
    {
      "name": "Nicole"
    },
    {
      "name": "Sanne"
    },
    {
      "name": "Ann"
    },
    {
      "name": "Marjolein"
    },
    {
      "name": "Robert"
    },
    {
      "name": "Gosse"
    },
    {
      "name": "Lieke"
    },
    {
      "name": "Mischa"
    },
    {
      "name": "Chris"
    },
    {
      "name": "Willem"
    },
    {
      "name": "Gerard"
    },
    {
      "name": "Judith"
    },
    {
      "name": "polo"
    },
    {
      "name": "Catelijne"
    },
    {
      "name": "Stefanie"
    },
    {
      "name": "Marijke"
    },
    {
      "name": "Petra"
    },
    {
      "name": "Koos"
    },
    {
      "name": "Julien"
    },
    {
      "name": "Stefan"
    },
    {
      "name": "Saskia"
    },
    {
      "name": "Rebecca"
    },
    {
      "name": "Emilie"
    },
    {
      "name": "Noor"
    },
    {
      "name": "Albertine"
    },
    {
      "name": "Elisabeth&Christian"
    },
    {
      "name": "Eva"
    },
    {
      "name": "Bart"
    },
    {
      "name": "Hans"
    },
    {
      "name": "Andrew"
    },
    {
      "name": "Vian"
    },
    {
      "name": "Bob"
    },
    {
      "name": "Bas"
    },
    {
      "name": "Frido"
    },
    {
      "name": "Ellie"
    },
    {
      "name": "Nina"
    },
    {
      "name": "sibel"
    },
    {
      "name": "gerard"
    },
    {
      "name": "Bart en Nim"
    },
    {
      "name": "Janine"
    },
    {
      "name": "Japie"
    },
    {
      "name": "noor"
    },
    {
      "name": "hilde"
    },
    {
      "name": "bart"
    },
    {
      "name": "roos"
    },
    {
      "name": "maarten"
    },
    {
      "name": "robert"
    },
    {
      "name": "Caroline"
    },
    {
      "name": "sander"
    },
    {
      "name": "morgana"
    },
    {
      "name": "Aal"
    },
    {
      "name": "Aart"
    },
    {
      "name": "Adriaan"
    },
    {
      "name": "Agnes"
    },
    {
      "name": "Aisha"
    },
    {
      "name": "Albertien"
    },
    {
      "name": "Alfred"
    },
    {
      "name": "Alisa"
    },
    {
      "name": "Almira"
    },
    {
      "name": "Amanda"
    },
    {
      "name": "Amela"
    },
    {
      "name": "Ana"
    },
    {
      "name": "Andre"
    },
    {
      "name": "Andrei"
    },
    {
      "name": "Aniek"
    },
    {
      "name": "Anita"
    },
    {
      "name": "Anja"
    },
    {
      "name": "Anke"
    },
    {
      "name": "Anna"
    },
    {
      "name": "Anne"
    },
    {
      "name": "Annelien"
    },
    {
      "name": "Annelies"
    },
    {
      "name": "Annelous"
    },
    {
      "name": "Annemiek"
    },
    {
      "name": "Annet"
    },
    {
      "name": "Annette"
    },
    {
      "name": "Anouk"
    },
    {
      "name": "Ariane"
    },
    {
      "name": "arthur"
    },
    {
      "name": "Astrid"
    },
    {
      "name": "balbir"
    },
    {
      "name": "Barbara"
    },
    {
      "name": "Barry"
    },
    {
      "name": "Belén"
    },
    {
      "name": "Benedikt"
    },
    {
      "name": "Bernt"
    },
    {
      "name": "Beste"
    },
    {
      "name": "Bev"
    },
    {
      "name": "Bill"
    },
    {
      "name": "Boaz"
    },
    {
      "name": "Bouwe"
    },
    {
      "name": "Boyo"
    },
    {
      "name": "Bram"
    },
    {
      "name": "Brian"
    },
    {
      "name": "Britt"
    },
    {
      "name": "Buurtbelang Parknest"
    },
    {
      "name": "Camille"
    },
    {
      "name": "Carina"
    },
    {
      "name": "Carleen"
    },
    {
      "name": "Carlijn"
    },
    {
      "name": "Carlos"
    },
    {
      "name": "Carolien"
    },
    {
      "name": "caroline"
    },
    {
      "name": "Cees"
    },
    {
      "name": "Chaim"
    },
    {
      "name": "Charles"
    },
    {
      "name": "Charlotte"
    },
    {
      "name": "Christian"
    },
    {
      "name": "Christoph"
    },
    {
      "name": "Christopher"
    },
    {
      "name": "Cindy"
    },
    {
      "name": "Claartje"
    },
    {
      "name": "Claas"
    },
    {
      "name": "Claire"
    },
    {
      "name": "Claudia"
    },
    {
      "name": "Coen"
    },
    {
      "name": "Corien"
    },
    {
      "name": "Coriene"
    },
    {
      "name": "Corine"
    },
    {
      "name": "Cormac"
    },
    {
      "name": "Daan"
    },
    {
      "name": "Daniel"
    },
    {
      "name": "Daniël"
    },
    {
      "name": "danny"
    },
    {
      "name": "Dante"
    },
    {
      "name": "Daphne"
    },
    {
      "name": "David"
    },
    {
      "name": "Devi"
    },
    {
      "name": "Diederik"
    },
    {
      "name": "Dieuwertje"
    },
    {
      "name": "Dinant"
    },
    {
      "name": "Dorus"
    },
    {
      "name": "Dorine"
    },
    {
      "name": "Dylan"
    },
    {
      "name": "Elisabeth"
    },
    {
      "name": "Ellen"
    },
    {
      "name": "Elodie"
    },
    {
      "name": "Elsa"
    },
    {
      "name": "Else"
    },
    {
      "name": "Emily"
    },
    {
      "name": "Emma"
    },
    {
      "name": "Enrico"
    },
    {
      "name": "Enzo"
    },
    {
      "name": "Eric"
    },
    {
      "name": "erik"
    },
    {
      "name": "Erika"
    },
    {
      "name": "Erna"
    },
    {
      "name": "Erwin"
    },
    {
      "name": "Esther"
    },
    {
      "name": "Evan"
    },
    {
      "name": "Felix"
    },
    {
      "name": "Femmy"
    },
    {
      "name": "Fleur"
    },
    {
      "name": "Floating"
    },
    {
      "name": "Floor"
    },
    {
      "name": "Francine"
    },
    {
      "name": "Frank"
    },
    {
      "name": "Frans"
    },
    {
      "name": "Fred"
    },
    {
      "name": "Freek"
    },
    {
      "name": "Gabriel"
    },
    {
      "name": "Gaya"
    },
    {
      "name": "Gea"
    },
    {
      "name": "Genet"
    },
    {
      "name": "Gepka"
    },
    {
      "name": "Germaine"
    },
    {
      "name": "Gonnie"
    },
    {
      "name": "Guido"
    },
    {
      "name": "Gust"
    },
    {
      "name": "Hania"
    },
    {
      "name": "Hannie"
    },
    {
      "name": "Harma"
    },
    {
      "name": "Helene"
    },
    {
      "name": "Henk"
    },
    {
      "name": "Henning"
    },
    {
      "name": "Henny"
    },
    {
      "name": "Henriette"
    },
    {
      "name": "Herman"
    },
    {
      "name": "Hester"
    },
    {
      "name": "Hilde"
    },
    {
      "name": "Hugo"
    },
    {
      "name": "Huub"
    },
    {
      "name": "Ilja"
    },
    {
      "name": "Ilse"
    },
    {
      "name": "Ineke"
    },
    {
      "name": "Inez"
    },
    {
      "name": "Ingrid"
    },
    {
      "name": "Irene"
    },
    {
      "name": "Iris"
    },
    {
      "name": "Isabel"
    },
    {
      "name": "Isobel"
    },
    {
      "name": "Isolde"
    },
    {
      "name": "Jaap"
    },
    {
      "name": "jacomien"
    },
    {
      "name": "Jacomijne"
    },
    {
      "name": "Jacq"
    },
    {
      "name": "Jan"
    },
    {
      "name": "Janny"
    },
    {
      "name": "Jarik"
    },
    {
      "name": "Jasper"
    },
    {
      "name": "Jeanet"
    },
    {
      "name": "Jeanette"
    },
    {
      "name": "Jeannine"
    },
    {
      "name": "Jelle"
    },
    {
      "name": "Jeninke"
    },
    {
      "name": "Jeroen"
    },
    {
      "name": "Jet"
    },
    {
      "name": "Jimena"
    },
    {
      "name": "Jo"
    },
    {
      "name": "Jochum"
    },
    {
      "name": "Joeri"
    },
    {
      "name": "Johan"
    },
    {
      "name": "Joke"
    },
    {
      "name": "Jolanda"
    },
    {
      "name": "Jonas"
    },
    {
      "name": "Joop"
    },
    {
      "name": "Joost en Jorrien"
    },
    {
      "name": "Jop"
    },
    {
      "name": "Jordy"
    },
    {
      "name": "Jorna"
    },
    {
      "name": "Jorrit"
    },
    {
      "name": "Jos"
    },
    {
      "name": "Jose"
    },
    {
      "name": "Ju"
    },
    {
      "name": "Julia"
    },
    {
      "name": "Juna"
    },
    {
      "name": "Kaboiuter"
    },
    {
      "name": "Karen"
    },
    {
      "name": "Katia"
    },
    {
      "name": "Katie"
    },
    {
      "name": "kees"
    },
    {
      "name": "Kenneth"
    },
    {
      "name": "Kerstin"
    },
    {
      "name": "Kiek"
    },
    {
      "name": "Kik"
    },
    {
      "name": "Kim"
    },
    {
      "name": "Kimbal"
    },
    {
      "name": "Kitty"
    },
    {
      "name": "Klaudia"
    },
    {
      "name": "Koen"
    },
    {
      "name": "Kris"
    },
    {
      "name": "Kseniya"
    },
    {
      "name": "Lara"
    },
    {
      "name": "Laura"
    },
    {
      "name": "Laurens"
    },
    {
      "name": "Laurent"
    },
    {
      "name": "Leela"
    },
    {
      "name": "Lennert"
    },
    {
      "name": "Leonie"
    },
    {
      "name": "Leontien"
    },
    {
      "name": "Lewis"
    },
    {
      "name": "Liliane"
    },
    {
      "name": "linda"
    },
    {
      "name": "Linde"
    },
    {
      "name": "Lisa"
    },
    {
      "name": "Lisanne"
    },
    {
      "name": "Liz"
    },
    {
      "name": "Lizette"
    },
    {
      "name": "Loes"
    },
    {
      "name": "Lotte"
    },
    {
      "name": "Louise"
    },
    {
      "name": "Lu"
    },
    {
      "name": "Luca"
    },
    {